{
  "schemaVersion": 1,
  "id": "cyrene.tools.dataset-preparation",
  "name": "Dataset Preparation",
  "version": "0.2.1",
  "description": "Deterministic dataset preparation and resumable training-data curation.",
  "kind": "capability-plugin",
  "capabilities": ["dataset.preparation.v1"],
  "supportedServices": [
    "Cyrene-Catalyst"
  ],
  "methods": [
    {
      "name": "inspect",
      "interfaceVersion": "1",
      "executionMode": "service",
      "inputSchema": "contracts/v1/schema.json#/$defs/InspectRequest",
      "outputSchema": "contracts/v1/schema.json#/$defs/InspectResponse"
    },
    {
      "name": "prepare",
      "interfaceVersion": "1",
      "executionMode": "service",
      "inputSchema": "contracts/v1/schema.json#/$defs/PrepareRequest",
      "outputSchema": "contracts/v1/schema.json#/$defs/PrepareResponse"
    },
    {
      "name": "transform",
      "interfaceVersion": "1",
      "executionMode": "service",
      "inputSchema": "contracts/v1/schema.json#/$defs/TransformRequest",
      "outputSchema": "contracts/v1/schema.json#/$defs/TransformResponse"
    },
    {
      "name": "curate_training_records",
      "interfaceVersion": "1",
      "executionMode": "service",
      "inputSchema": "contracts/v1/schema.json#/$defs/TrainingCurationRequest",
      "outputSchema": "contracts/v1/schema.json#/$defs/TrainingCurationResponse"
    },
    {
      "name": "remap_training_record",
      "interfaceVersion": "1",
      "executionMode": "service",
      "inputSchema": "contracts/v1/schema.json#/$defs/RemapTrainingRecordRequest",
      "outputSchema": "contracts/v1/schema.json#/$defs/RemapTrainingRecordResponse"
    }
  ],
  "runtime": {
    "language": "python",
    "entrypoint": "dataset_preparation:DatasetPreparationPlugin",
    "protocol": "cyrene.plugin.runtime.v1.DirectPluginRuntime",
    "launch": {
      "executable": "prepared-runtime",
      "args": [
        "-B",
        "src/cyrene_plugin_runtime/bootstrap.py",
        "--entrypoint",
        "dataset_preparation:DatasetPreparationPlugin"
      ]
    }
  },
  "compatibility": {
    "platformVersion": ">=0.1.0",
    "requiresPython": ">=3.11",
    "os": ["linux", "windows", "darwin"]
  },
  "secrets": {},
  "state": {
    "isStateful": false,
    "storageCategory": "stateless",
    "retentionPolicyOnUninstall": "retain"
  }
}
